{
  "id": "book-decon",
  "version": "0.4.0",
  "displayName": "book-decon",
  "description": "Book deconstruction entry skill (Phase 0, T1.1). Confirms the source package is ready, validates manifest.json and the merged chapter index, reads the frozen 拆解配置.json, then routes to book-decon-dimension. Falls back to in-conversation scope intake when no config exists. Self-contained; independent from this repo's pop-decon skills.",
  "tags": ["拆书与分析"],
  "entry": "SKILL.md",
  "activation": {
    "slashCommands": [],
    "default": false
  },
  "permissions": {
    "readProjectFiles": true,
    "writeProjectFiles": true,
    "network": false,
    "shell": false
  },
  "loadPolicy": {
    "includeReferences": "on-demand",
    "maxPromptChars": 60000
  }
}
