{
  "id": "05-pop-novel-creative",
  "version": "1.4.0",
  "displayName": "创意打磨",
  "description": "创意打磨 v1.4.0。Phase W0/W1 采集燃料（跨域素材+拆书融合）→ Phase 0 元素碰撞 → 0.3 参考书策略 → 0.4 主角设计 → 0.5 样品试读。全部产出 .md 叙事优先。输出故事引擎后交给 world。",
  "entry": "SKILL.md",
  "activation": {
    "slashCommands": [
      "开书",
      "创意",
      "creative",
      "新书"
    ],
    "default": false
  },
  "permissions": {
    "readProjectFiles": true,
    "writeProjectFiles": true,
    "network": true
  }
}
