{
  "id": "pop-novel-master",
  "version": "1.0.0",
  "displayName": "网文创作专家·Master",
  "description": "网文创作技能集群的总控路由，根据任务类型分配到对应子skill。挂载角色后自动路由到最合适的子skill。",
  "entry": "SKILL.md",
  "activation": {
    "slashCommands": [
      "novel-master",
      "nm"
    ],
    "default": false
  },
  "permissions": {
    "readProjectFiles": true,
    "writeProjectFiles": true,
    "network": true,
    "shell": true
  }
}