{
  "id": "02-pop-novel-deconstructor",
  "version": "11.1.0",
  "displayName": "拆书元Skill（模板工厂+ETL管道）",
  "description": "拆书元Skill v11.1（ETL管道模式）。写前强制执行数据提取脚本（_scripts/），产出 _temp/*.json 作为唯一原料。Lv1快速扫描（~25min，6文件）→ Lv2标准模板（~1-3h，~20文件）→ Lv3工厂级（~3-8h，~50+文件）。触发词：拆书/拆解/分析/提取模板/对标/快速拆。",
  "entry": "SKILL.md",
  "activation": {
    "slashCommands": ["拆书","解构","分析","deconstruct","拆解","对标","快速拆","提取模板"]
  },
  "permissions": {
    "readProjectFiles": true,
    "writeProjectFiles": true
  }
}
